{
  "type":"hat",
  "attached_bone": "HEAD",
  "model":"lunar:cosmetics/models/geckolib/hats/em_fox_ears/model.geo.json",
  "texture":"lunar:cosmetics/models/geckolib/hats/em_fox_ears/em_fox_ears.webp",
  "animation":"lunar:cosmetics/models/geckolib/hats/em_fox_ears/model.animation.json",
  "state_machine":{
    "name": "single",
    "transition_tick_length": 10,
    "anim": "animation"
  },
  "transformations": [{
    "transformType": "translate",
    "values": {
      "gui": {
        "x": 0.0,
        "y": 0.15,
        "z": 0.05
      }
    }
  }]
}
