{
   "type":"hat",
   "attached_bone": "HEAD",
   "model":"lunar:cosmetics/models/geckolib/hats/propeller2/model.geo.json",
   "texture":"lunar:cosmetics/models/geckolib/hats/propeller2/texture.webp",
   "animation":"lunar:cosmetics/models/geckolib/hats/propeller2/model.animation.json",
   "state_machine":{
     "name": "single",
     "transition_tick_length": 10,
     "anim": "Propeller"
  }
}
